{
  "schema_version": "0.1.0",
  "currency": "CNY",
  "market": "mainland_china",
  "household": {
    "household_id": "fictional-household-001",
    "members": [
      {
        "role": "adult",
        "age": 38
      },
      {
        "role": "adult",
        "age": 36
      },
      {
        "role": "child",
        "age": 6
      }
    ]
  },
  "facts": {
    "annual_income_cny": 650000,
    "annual_expense_cny": 320000,
    "liquid_assets_cny": 900000,
    "home_equity_cny": 2800000,
    "mortgage_balance_cny": 1800000,
    "insurance_context": {
      "has_life_insurance": true,
      "has_critical_illness_policy": true
    }
  },
  "confirmation": {
    "status": "fictional_example_only",
    "customer_data": false
  }
}
